subreddit,title,selftext,upvote_ratio,score,created_utc
stocks,China Vows to ‘Fight to the End’ If US Insists on New Tariffs,"[https://finance.yahoo.com/news/china-vows-fight-end-us-011817316.html](https://finance.yahoo.com/news/china-vows-fight-end-us-011817316.html)

China slammed the US for threatening to raise tariffs and pledged to retaliate if Washington follows through, raising the stakes of the trade war between the world’s two largest economies.

“The US threat to escalate tariffs on China is a mistake on top of a mistake, which once again exposes the blackmail nature of the US,” the Chinese Ministry of Commerce said in a Tuesday statement. “If the US insists on its own way, China will fight to the end.”

Beijing and Washington are already on track to raise blanket tariffs on each other this week. Trump on Monday added a new threat to put an additional 50% levy on Chinese imports.

US threats and pressure are “not the right way to engage” with China and the nation will defend its interests, China’s embassy in Washington said.

“The US hegemonic move in the name of ‘reciprocity’ serves its selfish interests at the expense of other countries’ legitimate interests and puts ‘America first’ over international rules,” embassy spokesman Liu Pengyu said in response to a question on the latest US move.

“China will firmly safeguard its legitimate rights and interests,” he said, without specifying any actions.",0.84,13,1744077025.0
stocks,you reckon is a good moment?,"as the title says, i live in korea and im looking to invest just a tiny amount (5k, i know its smol af). im in for the long term tbh just want to put it in and forget about it. see how it goes and MAYBE invest some more in the future. what do you reckon?",0.6,2,1744072933.0
stocks,It feels like this might be the denial phase. I hope I'm wrong.,"To me it seems like the Trump administration wants to send a knife straight through China. At all costs. To avoid public backlash from delivering a sufficient blow, they need to give the illusion of negotiation and dial the beat of the drum high enough to drown out opposing analysis. Anything less than a concerted, three-dimensional strike will allow China to ""weasel"" away and re-entrench elsewhere by ""cheating"" as is often brought up. (China+1, tax havens)


Whether this will achieve their goals or is beneficial in the end to us investors, is not important right now. So when people bring up the market drops or potential economic fallout as a disastrous, it will be phrased as worthwhile. Our portfolios are no longer a bargaining chip to sway the current plan of action, and are thus up for sacrifice.


Setting aside ""right"" or ""wrong"", is there a thesis for staying in the market? I believe that the administration's actions aren't inept, but are part of a calculated, strategic design, and an unfortunate, albeit intentional, period of market depression is just collateral damage.",0.82,25,1744070637.0
stocks,What is a sign that the plummet is over?,"I had my financial advisor take me out of the stock market mid January. He gave me a cautionary ‘making a mistake’ speech. I just had a feeling that this was coming. However, I have no idea how to know when to get back in. I’m not an avid market follower so I don’t know what any of the signs are.",0.63,7,1744070176.0
stocks,News eToro and Klarna halt US IPO plans due to market instability,"eToro and Klarna have decided to halt their plans for an Initial Public Offering (IPO) for the US following President Donald Trump’s tariff announcements. 

Since US President Donald Trump announced additional sweeping tariffs on goods imported from abroad on 2 April 2025, the whole world has been in turmoil, with many regions responding to the move. Even if Trump believes that these tariffs could expand the US economy and encourage consumers to buy more American-made goods, leaders from around the world underlined that his initiative could lead to significant consequences for people globally. Also, according to the [BBC](https://www.bbc.com/news/articles/cn93e12rypgo), South Korean officials stated that the global trade war has now become a reality, while Canadian representatives highlighted the region’s plans to act with purpose and force. At the same time, worries about a trade war brought stocks down after Trump released the sweeping tariffs plan that could negatively impact the worldwide economy.

Considering the current situation and the high market volatility, many companies seeking a US IPO decided to delay their plans. Among them are Klarna and eToro, as well as Medline and StubHub, with all of them citing market instability as the reason for their choice.

# Klarna and eToro’s decision to delay US IPO

According to sources familiar with the matter cited by [Reuters](https://www.reuters.com/technology/klarna-pauses-us-ipo-plans-amid-tariff-turmoil-wsj-reports-2025-04-04/), Klarna momentarily put a stop to its arrangements for the US IPO. The move could obscure the recovery of the US IPO market, as Klarna’s listing was considered a potential stimulus for supporting other companies to take a similar approach. However, as per the same sources, the Swedish fintech could re-examine its plans if market conditions become more stable and favourable. A research analyst from IPOX mentioned that this type of market uncertainty could lead any company, regardless of the sector it operates in, to pause its near-term IPO plans.

Furthermore, eToro, an Israel-based social trading-focused online broker, which filed for a US IPO at the beginning of [February 2025](https://thepaypers.com/cryptocurrencies/etoro-confirms-ipo-filing-with-us-authorities--1272263), also postponed its preparations for the offering. As detailed by [Bloomberg](https://www.bloomberg.com/news/articles/2025-04-04/trump-s-trade-war-hits-billions-of-dollars-of-deals-in-24-hours), the company aimed to start its investor roadshow in the upcoming period. However, with the recent tariffs and market instability, it has stalled it indefinitely.

[Source](https://thepaypers.com/payments-general/etoro-and-klarna-halt-us-ipo-plans-due-to-market-instability--1273028)",0.94,12,1744069584.0
stocks,How can I take advantage of the dip? 22F in university.,"Like it says on the tin, how can I take advantage of the dip? I have about 2.5k liquid and about 8.6k in government I-bonds (but past the 6-month probationary period). I'm in a pretty good position to invest, I have about more than 730 points in my credit score, but I really don't know how to invest. People say to avoid RH and go to Fidelity, but that isn't marked as beginner-friendly from what I hear. I'm familiar with some aspects of the stock market but not familiar with terms or options, and I have ADHD so a lot of the guides I find on the internet make me more confused than knowledgable. 

Are there any guides for people tailored like me? Would Fidelity be a good idea to use even as a beginner? Is there a way I can get a loan from the bank to invest in the dip and pay it back when the market comes back around? All help is appreciated. &lt;3",0.26,0,1744068792.0
stocks,Too late to short or no?,"Basically title with some caveats. Looking for opinions on what to short as well if it’s still a good time. To give some context, I’ve always played the long game and only invested in three things at the moment. Real state, 401k, and IRA, however, with the current volatility, looking at some options to play with a bit of cash (~200k) TIA",0.36,0,1744068344.0
stocks,Forget Money Markets go with UDN - Inverse Dollar ETF,"If you are sitting out of the market in money market funds, congrats!  You were able to preserve your capital.  However, there is a thesis to Trump devaluing the dollar next and to protect your capital from that, US based money market funds isn’t going to cut it.

I base this thesis off of Stephen Miran’s paper [A User’s Guide to Restructuring the Global Trading System](https://www.hudsonbaycapital.com/documents/FG/hudsonbay/research/638199_A_Users_Guide_to_Restructuring_the_Global_Trading_System.pdf).  In this paper Miran discusses enacting the International Emergency Economic Powers Act, enacting tariffs (at 20%), and devaluing the dollar.  Trump has done steps 1 and 2 so far.  One way that the President can devalue the dollar without Congress is through imposing fees on foreign US Treasury holders.  

But tariffs are supposed to strengthen the dollar!  Even Miran mentions the dollar could go up at the beginning of tariffs.  With restricted imports the trade deficit will be reduced which could raise the dollar however, in the medium term we have other countries placing tariffs on the US, an economic slowdown, and investor uncertainty.  Add to that Trump potentially actively looking to lower the dollar and in the next few months the dollar could be crushed.

USD denominated money markets make about 4% right now.  UDN (the inverse dollar ETF) has already risen 6% YTD.  If the dollar gets seriously devalued though that 4% isn't going to matter much to the world economy and one way to protect your account is to invest in UDN in the next month or so.

Would love to hear your take on this.


",0.5,0,1744068279.0
stocks,Leveraged Bets Dominate Trading in Tariff Rout Like Never Before,"https://www.bloomberg.com/news/articles/2025-04-07/leveraged-bets-dominate-trading-in-tariff-rout-like-never-before

&gt; Late last week, as stocks across the globe lurched lower in the wake of US President Donald Trump’s tariff blitz, a striking pattern emerged in the $10 trillion US market for exchange-traded funds.

&gt; No fewer than eight of the 13 most-traded ETFs on Friday were funds that use options to offer juiced-up or inverse returns of various indexes or single stocks. In fact, the top four comprised a triple-leveraged bet on semiconductor stocks, an amped-up bullish wager on Tesla Inc., a vehicle promising three times the performance of the Nasdaq 100, and the latter’s bearish sibling.

&gt; The world’s biggest and most-liquid ETF, the SPDR S&amp;P 500 ETF Trust, was fifth on the list, even as it lured $9.4 billion in new cash.

&gt; Many of these funds are popular among the retail-trading crowd, with do-it-yourself investors gravitating toward them to take high-conviction bets on all manner of asset classes or single stocks. There were signs last week, amid a widespread market rout, that some were taking the big selloff as dip-buying opportunities.",0.8,3,1744067493.0
stocks,Broadcom to Buy Back $10 Billion in Shares Following Stock Slide,"https://www.bloomberg.com/news/articles/2025-04-07/broadcom-to-buy-back-10-billion-in-shares-following-stock-slide

&gt; Broadcom Inc., a supplier of semiconductors to Apple Inc. and other big tech companies, announced plans to buy back as much as $10 billion in shares, saying it remains confident in the chip industry.

&gt; The board has authorized the repurchase through Dec. 31, Broadcom said in a statement Monday. The announcement sent the company’s shares up about 3% in late trading.

&gt; The stock had been down 34% this year through the close of regular New York trading, part of a broader tech rout fueled by tariff concerns.

&gt; The buyback “reflects the board’s confidence in the strength of Broadcom’s diversified semiconductor and infrastructure software product franchises,” Chief Executive Officer Hock Tan said in the statement. The Palo Alto, California-based company is “uniquely positioned” to help large cloud-computing companies adopt generative artificial intelligence, he said.",0.93,24,1744066703.0
stocks,Apple’s 3-day loss in market cap swells to almost $640 billion,"While the stock market broadly fared better on Monday than in the prior two trading days, Apple got hammered once again, losing 3.7%, as concerns mounted that the company will take a major hit from President Donald Trump’s tariffs.

The sell-off brings Apple’s three-day rout to 19%, a downdraft that has wiped out $638 billion in market cap.

Apple is one of the most exposed companies to a trade war, analyst say, due largely to its reliance on China, which is facing 54% tariffs. Although Apple has production in India, Vietnam and Thailand, those countries also face increased tariffs as part of Trump’s sweeping plan.

Among tech’s megacap companies, Apple is having the roughest stretch. On Monday, the only stocks to drop in that group of seven were Apple, Microsoft and Tesla.

The Nasdaq finished almost barely up on Monday after plummeting 10% last week, its worst performance in more than five years.

Analysts say Apple will likely either need to raise prices or eat additional tariff costs when the new duties come into effect. UBS analysts estimated on Monday that Apple’s highest-end iPhone could rise in price by about $350, or around 30%, from its current price of $1,199.

Barclays analyst Tim Long wrote that he expects Apple to raise prices, or the company could suffer as much as a 15% cut to earnings per share. Apple may also be able to rearrange its supply chain so that imports to the U.S. come from other countries with lower tariffs.

Apple declined to comment on the tariffs.

Source: [Apple's 3-day loss in market cap swells to almost $640 billion](https://www.cnbc.com/2025/04/07/apples-3-day-loss-in-market-cap-swells-to-almost-640-billion.html)",0.98,143,1744064581.0
stocks,"Is the reporting of this rally being caused by ""Fake News"" inaccurate?","Most sources have claimed the flash-rally was due to a fake tweet, and subsequent amplification, about a 90-day tariff pause. However, I'm struggling to find evidence this is the case, and am hoping to get some of your thoughts. The timeline I currently have:

9:45am - Market rally begins

9:53am - Hasset, on Fox news, responds to the question of 'Will you do a 90 day pause' with: ""Yeah... you know, the president is going to decide what the president's going to decide"".

10:00am - S&amp;P locks in at the 5000 resistance level

10:10am - Fast rally into positive territory

10:13am - The claimed triggering tweet that 'Hasset said there will be a 90-day pause' is posted. 

10:17am - The rally peaks, and shortly after multiple stations begin reporting that a flash rally was caused by a ""Fake News"" mistake about a 90-day rally.

If anything, it almost looks like the reporting of ""a 90-day delay is fake news"" seemed to specifically *stop* the rally

Am I missing something in my timeline, perhaps a source before the 10:13 post?",0.86,21,1744064437.0
stocks,I usually look at VIX to find when to buy in. Looks like today is peak?,"Usually vix surge like today doesn't come often I think.
Seems like today's surge at 60 is really high but closed at 47.
47 is still but high but I doubt that it will be higher than 47 tomorrow.

Means sellout like today won't happen tomorrow or this week or near future and today closed with uptrend.
Does this mean today was the bottom and we won't see prices like today any time soon?",0.63,7,1744064064.0
stocks,"Please help me explain to my neighbors how the stock market's serious illness can affect  "" people who do not have stocks "".","My grandparents were destroyed by the depression. In 1928 they had a velvet couch and jewelry and jobs: By 1933 they nearly starved. I live in an area that worships Mr. Trump. I quietly do not. They really just say ignore TV and the TV news. 
   I am the low income, disabled senior in a gentrified small town. All of them like me, and insist I will not lose Social Security, Medicare and Medicaid. I am terrified, and I do not understand how these people can be serene. I also do not know why they feel the stores and banks will be unaffected. Thank You for your reply. ",0.84,171,1744062747.0
stocks,Why selling amidst tariffs may be a bad idea.,"First of all, I'm a zoomer who has just started learning about investing in general, so if my thoughts are incorrect feel free to say it. 

I think, it's unlikely that prices of shares fall more. Not because the economy isn't fucked, or US companies won't have massive losses due to tariffs, but because there's also going to be a lot of inflation. When selling, you aren't only selling a piece of a company, you are also ""buying"" US dollars. If prices increase, the value of those dollars is going to fall, maybe even faster than the value of companies. If the economy becomes more asset based, isn't it better to own a piece of a company than cash? ",0.32,0,1744061792.0
stocks,Chinese Embassy says will not bow to fresh Trump tariff threat,"China says it would not cave to pressure or threats after Trump promised additional 50 percent tariffs on its goods if Beijing did not retract planned countermeasures.

&gt;“We have stressed more than once that pressuring or threatening China is not a right way to engage with us. China will firmly safeguard its legitimate rights and interests,” Liu Pengyu, spokesman for Beijing’s embassy in the United States, told AFP.



[https://aje.io/aolp79?update=3628842](https://aje.io/aolp79?update=3628842)",0.99,1709,1744060264.0
stocks,Pure market manipulation.,"So, futures dumped. Pre-market dumps. The market opens and we continue to dump. We all know what's coming. ""Black Monday"". There are no dip buyers because nobody wants to catch a falling knife,  and everyone else is grinning because they are short (me included). THEN out of nowhere, magically there is some ""news"".  Then the market does a huge reversal. Word comes out that it's ""fake news"". The market then shifts back the momentum, but at that point clear direction is lost, algos are confused. Traders are confused, and we just chop around. There is no doubt in my mind that ""fake news"" was put out there on purpose to stop the bleeding. And it worked. I think it was either a desperate move by the Trump Administration or some whale that was long and wanted to not get smoked. ",0.91,1965,1744059940.0
stocks,Stock Market: a reason to be calm.,"Right now the S&amp;P 500 is about where it was in March 2024:

  [https://www.multpl.com/s-p-500-historical-prices](https://www.multpl.com/s-p-500-historical-prices)

The total return (including dividends) since last year is positive. Yet the popular media keeps showing pictures of stock traders who look like they want to puke. I think the media is trying to create a buying opportunity by scaring people, so there can be the usual transfer of wealth from the emotional to the stoic. Stay calm everybody!",0.31,0,1744058823.0
stocks,Earnings per share divided by the last quoted share price ration USEFUL?,"as the tittle suggest, i am asking if anyone would find useful to build a ratio defined as X = EPS/(last price of its stock) to come up with a percentage of how much is the company earning, or how much are you getting in return for per every stock purchase.

basically, i want to bring all stocks to a common ground as some have 22 EPS but their stock is at 515, menawhile one stock has an EPS of 6 and its trading at 42.

  
22 EPS with their stock is at 515 would mean a yield of 4.27%

6 EPS with their stock is at 42 would mean a yield of 14.29%

  
would anyone find this useful?",0.5,0,1744058517.0
stocks,"The fake tweets today proves the market wants to come back, but will the rest of the week bring any more good?","Tariffs go into effect tomorrow. seeing as the refined hopium from some fake tweets kept the market flat today and caused a 7% spy movement on open, I'm thinking its blood tomorrow and even worse after hope for negotiations cools off by the end of the week.  Thoughts?",0.38,0,1744057997.0
stocks,USAR rises nearly 30 percent Monday,"This company has unbelievable potential for growth and will have minimal- even positive impact from the terrifs. 
They have state funding, and have been recently aqquired by Inquisition Point-  a blank cheque company involved in space faring and global banks.

The share value rose to 20 dollars just before the Market crash- sank to 5 dollars and has since seen consistent growth up to near 10 dollars in just over a week. 

Dm or comment and I will send you the HTML file of the acquisition documents (IPXX acquiring USAR)- they are incredibly promising. 

Happy to provide any information or respond to any questions. Just thought I'd share- 
3rd biggest growth on NASDAQ today",0.54,1,1744057663.0
stocks,What percentage of your savings is in stocks right now?,"And why do people put their life savings into stocks? I’m not talking about 15-30% but the ones here who are claiming to have vested anywhere from 80-100%. 

Now… I must preface this by saying I’m in my late 20’s and kept my head buried in the sand with the market because I feared what I didn’t yet understand. I still have a lot to learn and am not currently invested, but I’ve been starting to eye the market for the last couple years. 

I’m not asking this to patronize anyone, this is genuinely based on curiosity and a desire to both learn and understand!

I’m sure this has been asked to death, but bonus question: they say buy low sell high, but is now really the time to start investing for the long term? 

I technically have one stock with 18-20 shares that I was given by my first company when I was 18. It didn’t grow very quickly but it’s definitely grown over the last decade, at least a bit. 

I haven’t checked since the new year began, but to me, the money i might add to stocks isn’t to be considered as tangible wealth or anything I include with my net worth. It would be something I’d put away and keep tabs on but wouldn’t touch for over a decade if possible. Am I wrong in this thinking?

Before the tariffs and market crashing I planned to invest this year. Now, I’m not sure what to do. I’m seeing a lot of posts about people losing their “entire life savings” with the current state of things, but putting all of it into stocks versus some into a HYSA or other assets doesn’t sound right to me. 

What do you think? Can you share your experience with me?",0.75,10,1744056772.0
stocks,Trump rejects EU’s ‘zero-for-zero’ tariff offer,"https://www.cnbc.com/2025/04/07/trump-tariffs-live-updates-stock-market-crypto.html

&gt;Trump is rejecting the European Union’s offer of “zero-for-zero” tariffs with the U.S. for industrial goods.
&gt;
&gt;“No, it’s not,” Trump said in the Oval Office when asked if the deal, which European Commission President Ursula von der Leyen floated earlier Monday, was enough.
&gt;
&gt;“They’re screwing us on trade,” Trump said, criticizing the EU and the North Atlantic Treaty Organization, or NATO.
&gt;
&gt;Two Republican senators, Mike Lee of Utah and Wisconsin’s Ron Johnson, have encouraged Trump to take von der Leyen’s deal.

What's the goal here if they're just gonna reject every deal offered?",0.97,3951,1744056100.0
stocks,Tariffs kick into affect tomorrow. Will the markets tmmr be up or down as a result?,"I know today the markets are churned, rising and falling. But I’ve heard a lot of people say tmmr is the real “D-day” because of the fact the tariffs actually start tmmr. However it could also be the end of the tariff fall and a start of a recovery as the market already seem to be recovering slightly and today was not as bad as many predicted. So based on what we’ve seen so far do we think tmmr will finally be a Green Day or be the D day?  Basically, is this priced in? 

Edit: mb everyone they take affect on Wednesday April 9th. I thought today was the 8th and have been writing the wrong date all day long ",0.78,87,1744053441.0
stocks,SemiConductor Stocks,"Trump floated in his state of the union that he would repeal the CHIPS act, which provided grants and loans to a variety of US chip manufacturers. This caused a small dip in stocks like $INTC at the time. However, I'm extremely doubtful he'll go through with this.^(1)

The recent tariff talks have made me wondering whether chip and chip-adjacent companies can invest further in U.S. manufacturing. They may suffer by losing a customer base in asia, but the U.S. is still a massive chip market. In fact, Trump recently signed an EO promising $1 Billion in investment in US semiconductors.^(2)

I prefer the smaller players like Micron Technologies $MU and Axcelis Technologies $ACLS. These two have experienced an above market bump so far today.^(3) Anyone else in U.S. semiconductor stocks?

  


1. ""[Trump wants Republicans to 'get rid of' the CHIPS Act. They may just ignore him.](https://www.businessinsider.com/trump-joint-address-chips-act-horrible-bill-2025-3?op=1)""
2. [https://www.eetimes.com/trumps-revamp-of-chips-act-aims-at-big-investments/](https://www.eetimes.com/trumps-revamp-of-chips-act-aims-at-big-investments/)
3. [https://companiesmarketcap.com/semiconductors/largest-semiconductor-companies-by-market-cap/](https://companiesmarketcap.com/semiconductors/largest-semiconductor-companies-by-market-cap/)

",0.33,0,1744052631.0
stocks,Should I empty my retirement accounts?,"30's and in the US. 

I have retirement split between ROTH and 401k, 

I'm not planning to retire for another 30 years. Should I empty my retirement accounts?

Will $10k in taxes and fees be better than staying aboard this sinking ship?",0.42,0,1744052069.0
