subreddit,title,selftext,upvote_ratio,score,created_utc
stocks,US debt owed by foreign countries,"I'm interested in hearing people's thoughts on foreign countries decision to sell their US treasury positions.

I assume the implication is this would hurt our ability to raise funds and put an intense amount of pressure on our borrowing costs.

",0.43,0,1744029781.0
stocks,"Just over an hour left until the markets open, final predictions...","What are your final predictions about what will happen when the American markets open for trading in an hour?

On one hand, the futures market is in the red and there's a panic in the European and Asian markets. Presumably, American investors will be left jittery from reading the news and might rush in and try to sell at the earliest opportunity. The worst case scenario would be another Black Monday.

On the other hand, the weekend may have calmed some of the panic amongst investors, so they might try to rideout the storm. There are also some investors trying to ""buy the dip"" and get in on the opportunity, which would put upward pressure on the markets. 

On balance, I am thinking there will be at least a few more days of pandemonium in the markets. But it has to bottom out eventually.

Update: 5 minutes in and the market has opened with an immediate plunge.",0.83,96,1744029458.0
stocks,Who’s buying in this market?,"The title is not a personal question. Every stock transaction has a buyer and a seller involved. With panic in the market there are far more sellers trying to dump their stocks. 

So who are the buyers on the other end of these transactions if very few people are buying?

People keep talking about trillions wiped out of the market. It didn’t evaporate. Someone gained money and someone last money.  The money is still out there, just not in the market. When all this nonsense does end folks are going to enter the market again and they’ll be some buying opportunities. Question is when is that?",0.72,22,1744028392.0
stocks,How Does Buying the Dip Change if/when Fascism is Involved? (Genuine Question Please Don’t Mindlessly Delete This Post),When motivations in a country change as a result of fascism in particular are there any thoughts or knowledge on what types of stocks are smarter to invest in at a dip? Consider this a hypothetical if authoritarianism/fascism is not on your radar. Would this type of change just be another typical unpredictable market or does it actually make it more predictable? The question can probably be taken in multiple directions and is meant to be open ended. People who understand stocks better than me- how would this factor into your thinking? Thank you!,0.46,0,1744025966.0
stocks,Do you think the US will always still keep rising irregardless due to too many retail investors now being hardcoded into just DCA-ing?,"From what I see around me, that seems like the very popular and common mindset these days. I'm not from the US but here in my country people dont seem to care if the US stock market tanks or not. The Dow could fall by 90% for all I know and these people would still convince themselves positively it's a great bargain/discount to buy more. To them, the US market can never falter no more what. No matter what and how economically damaging of anything Trump does. They believe 80 years of proven history of an ever increasing stock market will continue perpetually forever or something.

I think that's also why the market got overheated post Covid crash. This was also the time during lockdown tons of people became invested into stocks. So the market became flushed with cash from the retail investors blindly DCA-ing nonstop. So no matter what, these growing number of casual investors will just keep throwing money non-stop at the stock market. The US could crash completely to the ground and these people would still think it's temporary and they'll benefit greatly from it.

",0.33,0,1744023549.0
stocks,is now a good time to invest for long term or would it be better to wait till things potentially balance out?,"New to stock market, I have some savings that I have been sitting on for a while and have wanted to move them into a stock portfolio for a while now, I figured now might be a good time to buy the dip but I am worried things are only going to get worse, anyone have any advice on what to do?

Thanks",0.5,0,1744022644.0
stocks,"This is a good (or bad) time to remind everyone that to make up a -50% loss, you need +100% to break even.","When dealing with indices, because of how stable they have been, to break even, the amount gain required is typically the same as the amount loss, i.e. a 2% loss typically requires a 2% gain to break even, and even in a bad scenario, a 10% loss still only requires an 11% gain to break even. But anyone who deals with more volatile markets knows that a 33% loss requires 50% gain, a 50% loss requires a 100% gain, and a 67% loss requires a 200% gain to break even. 

Given how big the drops in market indices are, this is a good (and bad) time to remind those who only deal with indices/DCA that the % in gains has to be larger than the % in losses if you wish to break even.",0.87,840,1744022505.0
stocks,DCA verse Cash,"I am a bit confused with everyone saying to DCA right now, why not sell and buy in at a lower price? Sorry if this is a stupid question and I know timing the market is always not suggested but if I truly believe the market will continue to dip, wouldn’t it be smart for me to pull money out, hold it in cash and then buy at a lower price?

Please feel free to just call me an idiot if I am missing something obvious…",0.5,0,1744019373.0
stocks,"So, what are we all buying today?","So much for the markets pricing tariffs in...

Markets tanking. VIX pushing 50+. Futures bleeding red. Headlines comparing this to the Great Depression. Trump just slapped the global economy with a 20% tariff sledgehammer and said “sometimes you have to take medicine” while flying over it all on Air Force One.

So… what are we buying?

* VIX calls?
* SQQQ/UVXY for the chaos riders?
* Oil? Gold?
* Or are we catching falling knives like AAPL, NVDA, or SPY and going long into the void?

Let’s hear it. What’s the play? Who’s hedging, who’s buying the dip, and who’s just watching it burn with popcorn? ",0.76,15,1744018543.0
stocks,"r/Stocks Daily Discussion Monday - Apr 07, 2025","These daily discussions run from Monday to Friday including during our themed posts.

Some helpful links:

* [Finviz](https://finviz.com/quote.ashx?t=spy) for charts, fundamentals, and aggregated news on individual stocks
* [Bloomberg market news](https://www.bloomberg.com/markets)
* StreetInsider news:
  * [Market Check](https://www.streetinsider.com/Market+Check) - Possibly why the market is doing what it's doing including sudden spikes/dips
  * [Reuters aggregated](https://www.streetinsider.com/Reuters) - Global news

If you have a basic question, for example ""what is EPS,"" then google ""investopedia EPS"" and click the investopedia article on it; do this for everything until you have a more in depth question or just want to share what you learned.

Please discuss your portfolios in the [Rate My Portfolio sticky.](https://www.reddit.com/r/stocks/search?q=author%3Aautomoderator+title%3A%22Rate+My+Portfolio%22&amp;restrict_sr=on&amp;sort=new&amp;t=all).

See our past [daily discussions here.](https://www.reddit.com/r/stocks/search?q=author%3Aautomoderator+%22r%2Fstocks+daily+discussion%22&amp;restrict_sr=on&amp;sort=new&amp;t=all)  Also links for:  [Technicals](https://www.reddit.com/r/stocks/search?q=author%3Aautomoderator+title%3Atechnicals&amp;restrict_sr=on&amp;include_over_18=on&amp;sort=new&amp;t=all) Tuesday, [Options Trading](https://www.reddit.com/r/stocks/search?q=author%3Aautomoderator+title%3Aoptions&amp;restrict_sr=on&amp;include_over_18=on&amp;sort=new&amp;t=all) Thursday, and [Fundamentals](https://www.reddit.com/r/stocks/search?q=author%3Aautomoderator+title%3Afundamentals&amp;restrict_sr=on&amp;include_over_18=on&amp;sort=new&amp;t=all) Friday.",0.94,58,1744018233.0
stocks,"The SPY ETF is approaching a very strong support level, which could potentially be reached as early as today","The SPY ETF is approaching a very strong support level, which could potentially be reached as early as today.

While this might not be the ultimate bottom, a sharp technical rebound from this area is highly probable. Therefore, in moments like these, it's crucial to set aside reasoning and emotions and act mechanically. Anyone unable to do this risks missing a significant opportunity.

You could potentially just trade the bounce and then sell, but I strongly advise against both shorting the market and staying completely inactive.

The market seems to be pricing in the worst-possible scenario already. If you wait to enter until the situation has fully resolved, you will likely be too late – remember that the market is highly forward-looking and anticipates events well in advance.

The key support zone for SPY starts around $475 and extends down to $458. It would be advisable to consider initiating at least a partial long position within this zone.

I want to stress that while the probability is high, it's never a certainty. Therefore, going 'all in' would still be a mistake.

In summary: from a statistical perspective, the most prudent course of action upon reaching this support level is to buy.",0.31,0,1744017592.0
stocks,Price fluctuation of SGOV?,"Im looking at the price of sgov pre market, and its down a bit from the close on friday, I just put my money in SGOV but worried that it can go down like how it was down in 2020-2022. Honestly it doesn't make sense to me that that price was lower during that time, shouldn't it have been higher? Aren't yields and prices inversely related? But should I be worried that the price can drop again to \~100.01 again and should I be selling them? or is it just a normal daily fluctuation and will go back up to \~100.64 again?",0.75,4,1744016465.0
stocks,"Hedge funds capitulate, investors brace for margin calls in market rout","https://www.reuters.com/markets/wealth/global-markets-tariffs-margincalls-pix-2025-04-07/

**Some hedge funds offload all stocks as selloff widens**

**Prime brokers say leverage falling, more selling coming**

**Sales triggered by margin calls rise in South Korea**

Some hedge funds say they are offloading all or most of their holdings of stocks as U.S. President Donald Trump's trade war wipes out trillions of dollars of market value and forces them to curtail trading using borrowed cash.
In the three trading days following Trump's announcement of broad reciprocal tariffs on almost all countries, stock markets across the world have plummeted, and bonds have become both a haven and a bet on rate cuts by the Federal Reserve, turning on their head market assumptions before Trump took office.

""The macro picture is getting very chaotic, and I cannot see the future clearly at all,"" said Xin, who sold his China and Hong Kong-listed shares last Thursday, ahead of a public holiday on Friday.
Hedge funds that pursue a long-short equity strategy have been particularly hard-hit as market volatility metrics (.VIX), opens new tab surged, brokers said.
Analysts at J.P.Morgan estimated net leverage, which refers to borrowing, by hedge funds fell between 5% and 6% last week over the previous one, and that net hedge fund leverage could be around the lowest since late 2023.",0.96,66,1744016111.0
stocks,Is it a bad time to invest?,"I’ve thought about investing my money into stocks for quite a long bit everyone knows what’s happening right now with the stocks market.
I thought that it is not the right time to invest but I had a second thought, what if it is the best time to invest (because the stock market is low) and will the stocks get up when Trump stops playing with economy?
Am I wrong for wanting to invest at that time?",0.56,2,1744015949.0
stocks,Why does Trump want to balance the trade deficits to zero?,"Obviously the stock market is falling and this is due to tariffs that are backed by math that look like they were scribbled on a napkin at 3am at a Dennys. But his rationale is that he wants to balance the trade deficits eg. Imports should == exports.

Does anyone have any clue why his goal is to balance trade deficits?  I really don't understand why he thinks trade deficits are something negative. After all, I have a trade deficits with my employer. They pay me more than I spend at their company. I have a trade deficit with my local grocery store. I buy more than they pay me.

Every economic collapse in the past has had some explanation, like the the pandemic or overleveraged banks and housing crises, etc. But this generational market collapse is just because some 82 yo thinks trade deficits are 'unfair'.

Honestly wondering if anyone anywhere has any explanation. I'm not looking forward to losing a tech job to build Huawei phones to export to China for 3.75/hr.",0.67,21,1744015948.0
