subreddit,title,selftext,upvote_ratio,score,created_utc
stocks,"EU will target less than €26 billion worth of U.S. imports, Sefcovic says","[https://finance.yahoo.com/news/eu-target-less-26-billion-152329503.html](https://finance.yahoo.com/news/eu-target-less-26-billion-152329503.html)

LUXEMBOURG (Reuters) - The European Union's countermeasures targeting a list of U.S. imports in response to the Trump's administration steel and aluminum tariffs will be less than 26 billion euros' ($28.46 billion) worth after taking in account member states' remarks, EU trade commissioner Maros Sefcovic told reporters on Monday.

""When it comes to steel, aluminum and derivatives (...) we are talking about 26 billion euros. We are finalizing the list tonight (...) but I can tell you that it will not be up to the level of 26 billion euros, because we've been listening very carefully to our member states,"" he told reporters.

As part of the U.S. administration's sweeping tariffs plan, the 27-nation EU bloc faces 25% import tariffs on steel and aluminium and cars.

""We wanted to make sure that the burden is spread fairly among all member states,"" Sefcovic added.

Earlier in the day, European Commission President Ursula von der Leyen held a call with metals industry representatives on Monday and was due to speak later to the automobile sector about how to respond to U.S. tariffs.

($1 = 0.9137 euros)",0.84,56,1744040068.0
stocks,Roth IRA - 100% VT over 20 Years,"I'll try to make this quick. I'm more of a crypto guy trying to learn about stocks. My goal is to retire in 20 years, 2045 at 60 years old. I already have a 401k through my employer. Recently I created a Roth IRA with Fidelity and have been DCA into VT and my plan is to do so for the next 20 years. I chose VT over VTI/VOO because I am less optimistic about tech and American companies and think international will do just as well if not better over the long-term.

After I bought VT I learned about VFFVX target date funds. But I saw that the fees and minimum investment is quite high to get going. I guess I'm looking to you guys for validation that I haven't made a boneheaded decision going %100 VT with my Roth IRA.

Should I look into Bonds at some point to diversify? Any comments, criticisms, concerns welcome.",0.31,0,1744039500.0
stocks,Trump says China will be hit with an additional 50% tariff on top of existing tariffs if they don't withdraw their 34% retaliatory tariff,"https://www.cnbc.com/2025/04/07/trump-tariffs-live-updates-stock-market-crypto.html

Trump said:

&gt; Yesterday, China issued Retaliatory Tariffs of 34%, on top of their already record setting Tariffs, Non-Monetary Tariffs, Illegal Subsidization of companies, and massive long term Currency Manipulation, despite my warning that any country that Retaliates against the U.S. by issuing additional Tariffs, above and beyond their already existing long term Tariff abuse of our Nation, will be immediately met with new and substantially higher Tariffs, over and above those initially set. Therefore, if China does not withdraw its 34% increase above their already long term trading abuses by tomorrow, April 8th, 2025, the United States will impose ADDITIONAL Tariffs on China of 50%, effective April 9th. Additionally, all talks with China concerning their requested meetings with us will be terminated! Negotiations with other countries, which have also requested meetings, will begin taking place immediately. Thank you for your attention to this matter!",0.95,14538,1744039381.0
stocks,Why is Docusign ($DOCU) not a great buying opportunity? And a little inspiration...,"Before I jump in on a stock, let me first somberly say: Man. Red. So much red. So much pain. So much sadness, anger and worry in the world being reflect on Reddit. I just saw a legit post on a financial/trading sub for a suicide hotline. Wow. I feel you. 

I would just like to offer a little hope from a stoic philosophical mindset and life outlook I adopted from living a life that was largely out my control:

**You cannot control the external events happening around you. You can only control how you react to them.**

None of us can control any of this shit storm right now. Everyone has been betrayed whether they are aware of it or not. And the betrayal started long ago. We are just seeing the symptoms of it more and more as time goes on. Hate towards each other is not the answer nor will it make anything better. The best ""medicine"" you can take is to keep your cool and look out for one another. I don't know what ""medicine"" has been fed to the stock market but the side effect is obviously: ""*may turn red for many days.*"" As the old proverb states: ""*This too shall pass.*"" 

\*I am asking for this post: Can we please chill with the political BS? 

Let's move on to what we can control- our reactions and strategy. With that, why not buy Docusign ($DOCU)? You can't really put tariffs on an electronic agreement company. They aren't dependent on foreign supplied components, raw materials, movement of physical goods, or anything else being disrupted by tariffs. And thankfully, their CEO seems rather smart, sane, and not currently involved in global politics. They are an online based technology company that is globally accessible. From their own website:

""*Docusign is the global leader in electronic signature with more than a billion users in more than 180 countries worldwide.*""

Think about that for a minute. Every country, just about every business, and even a few penguins on the Heard and McDonald Islands are going to be scrambling to make adjustments. What does that mean? Lots of agreements will need to be inked really fast all over the globe. What is the fastest way to do that? Electronically. That is what Docusign does. I expect that Docusign will directly profit from all this chaos that will need to be reorganized by the entire world of business and government. 

My position: I first bought into Docusign after it collapsed post-COVID. I bought more after it dropped when the Bain Capital and Hellman &amp; Friedman acquisition attempt fell through. I'm still up and there is no way I am panic dumping it.

I would like to buy more once the current chaos calms. My questions are this: 

1. Are there any fundamental flaws with this theory that you can see? 
2. Do you think the overall markets will just pull Docusign down with it regardless if they outperform? 
3. If you thinks this makes sense, when would you buy? I get the logic behind all the quips like ""*don't try to catch a falling knife*"" and other similar such sayings. The stock is basically right where it was last November. So, it hasn't really sold off dramatically if you are thinking long and I am not trying to time this perfectly (nor is it possible). 

Keep your chins up. ",0.22,0,1744039322.0
stocks,The Stock market is ready to explode!!,"What we seen an hour ago is a market that is absolutely itching to pump.

8% intraday swing in literal seconds is an example of the upswing we are going to see.  THAT FAST!

30% 40% gains when the news hits.  NVDA to $140.  AMZN to $240.  Meta back to $700.  

In this game, patience will always prevail.  

",0.17,0,1744038906.0
stocks,IS THIS PERMANENT,"Is this crash going to last? Do you think we’ll get a pause on these tariffs sometime soon, will any of it even be effective? Just gonna keep holding and holding as I’m not knowledgeable enough to do anything else. This dude said he was gonna fix the economy and now all I see is red….

Do people think these tariffs will actually have the proposed outcome? These countries need our business so there has to be an outcome inevitably, but how much of a bad rep do we need.  

edit to be simpler",0.35,0,1744037992.0
stocks,Great way to deflate the bubble of everything,"Let’s play a mental simulation game while the markets burn guys (what else do you have to do?)

All of the things that’ve happened over the past couple months of the Trump presidency seem to make logical sense if you look at the markets from a perspective of centralized control (FED+massive collusion).

Think about it: nothing Trump’s done really flies in the face of US economic policy over the past 60 years since the start of the Cold War and US economic imperialism. Bretton Woods, fiat currency, IMF - all these things served the US. If the plan (and yes there was a plan according to declassified documents from the Kissinger era) was to create dependency on the US dollar and massive public debt, the end game was inescapable inflation worldwide - which would in the short term drive demand for the US dollar and cause massive value inflows into the US as world markets crashed. The US dollar would inflate last, but it would be beside the point because the US has the largest gold reserves in the world. It would also create a massive buying opportunity for US firms sitting on cash (in the short term). 

Cash is valueless - the end objective is OWNERSHIP of assets worldwide. Towards this end, the plan seems to be working perfectly. However, certain things have not gone to plan - BRICS, Bitcoin, and the general apathy of the American public’s nationalism seem to have had a weakening effect on the plan. The plan doesn’t seem as smart as it did 60 years ago.

What if Trump is the planned scapegoat for the deleveraging of inflated markets? If he acts as the lightning rod, markets could potentially be stabilized to sane valuations for at least a couple years, no? The end result of his actions will be his impeachment - there’s too much money being ‘lost’ (remember, it doesn’t exist in the market - it’s just perceived value because the amount of currency circulating doesn’t change).

What are your guys thoughts on this? ",0.13,0,1744037988.0
stocks,2045: S&amp;P500 is back to its all time high of 6144.,"
It’s 2045.
The S&amp;P 500 just touched 6144 again.
We made it back, boys.

But the world is different now.

The great crash of 2025 wiped out $17 trillion in market cap. Retirements evaporated. Boomers un-retired. Everyone works now. Forever. Because hey, we brought all the manufacturing jobs back!!!!!! 

U.S. brought manufacturing back. Steel, semiconductors, textiles—hell, even toasters are “Made in America” again.

But they cost four times as much. Inflation never really went away. Interest rates stayed high for years to “tame inflation” but all it did was tame hope. BRRRR machine stopped working after they ran out of printer inks made in China. 

Mortgage rates are still above 8%.
401(k)s are flat. American dream now: never retire, never die, keep the GDP alive.

But hey, we made it back!!!! 

EDIT: why so serious comments?? Relax folks, it’s meant as a satire, apparently not taken well… ",0.45,0,1744037761.0
stocks,"Dow falls 1,000 points in wild session as Trump tariff market collapse continues: Live updates","U.S. stocks were slammed for a third day on Monday as the White House remained defiant even after President Donald Trump’s rollout of shockingly high tariff rates on most key U.S. trading partners has caused a market meltdown.

Stocks mounted a short-lived rally shortly after the open that took the Dow Jones Industrial average into positive territory. Speculation of some sort of tariff pause circulated on trading floors and social media and may have contributed to the pop. The White House told CNBC that any talk of a 90-day pause was “fake news.”


https://www.cnbc.com/2025/04/06/stock-market-today-live-updates.html",0.94,744,1744037389.0
stocks,Has anyone here worked on the algorithms that financial institutions use to trade? How is it possible that the S&amp;P 500 went from -2% to +3%?,"The news was that Trump allegedly was talking about a tarrif pause for 90 days. The S&amp;P 500 skyrockets in a few minutes microseconds after this news is announced.

Are there any people in the industry here who have first hand experience coding these ""mythical"" algorithms that everyone talks about? How can they know the news so quickly. Is there any evidence it is caused by these algorithms?",0.89,204,1744036635.0
stocks,Good reading material?,"I dabbled with trading back in 2021-23, mostly just bought and held some etfs, but also did some credit and debt spreads with options. I've forgotten a lot of what I taught myself from then. Looking for some recommendations on good reading material, whether it be books or something online.

Thanks!",0.81,3,1744036546.0
stocks,There are a lot of dumb people posting here.,"Took me a while to realize, but this market drop made a lot of dummies come out and claim this particular time, the world is ending. It's been three years since the last market drop, guys. Not three hundred years, just three years. Calm the f*ck down.",0.47,0,1744036478.0
stocks,"Getting back into investing to take advantage of this dip, any good videos to watch as a refresher. Also what are you guys buying.","Hello everyone. Been out of the market other than the occasional DCA when I had extra money. Mostly blue chips and some other smaller companies I had faith in. With a new job and the big dip that’s been on going, I’d feel dumb to not invest more and get some better strategies, maybe get into options. Any pointers would be greatly appreciated!",0.29,0,1744035532.0
stocks,Broker limits Vanguard 500 transactions,"I'm a professor, so my 503b is with TIAA. I went into bonds/MM a month ago.

Out of curiosity, I looked to see if I could even start buying into Vanguard 500 index fund. TIAA has stopped transactions for this fund until 4/28! Whatever that means, it can't be good. Low liquidity? They are shorting SPY? No idea.

What are they doing?

EDIT: to be clear, TIAA is allowing transactions on other funds, so maybe this is a Vanguard thing or TIAA's decision for just this fund (because everyone is now trying to get out)?",0.78,10,1744035394.0
stocks,"Don't sell, it will go up","It comes back strong as expected after the fall.

Above all, do not liquidate your positions, do not make a call, just let the markets rise.

It will come back up quickly.

There is a lot of exaggeration in this situation, Trump is going to put water in his (French) wine.


The best days come right after the worst: stay exposed to the market.",0.36,0,1744035175.0
stocks,What are your picks for this week?,"Since most of the sub is panicking from a 1 yr low I thought I would ask what everyone else is buying this week. I'm looking for actual discussion among those DCA'ing into the volatility and not just those here for the drama or bottom chasers.

For me, buying into VGT, some chip or fab stocks like LRCX, and some large consulting and GovGon stocks. ",0.67,1,1744035173.0
stocks,We’re in a crash… how fast will the recovery will be?,"When it comes to crashes how fast the recovery is matters just as much as the crash itself.

With COVID the recovery was 4 months. No biggie.

With the Great Recession it took almost 4 years. Not great but ok.

With the Great Depression it took 22 years (!) to reach the same levels. This really wrecked people.",0.72,178,1744034341.0
stocks,Is this a good time to get rid of some losers?,"I’m down to being up only 2% on my entire portfolio after being up 40%. Is now a good time to sell everything and hold on to the cash, then rebuy the better performing stocks that were in my portfolio later?",0.4,0,1744034119.0
stocks,Pay attention to after-hours and the VIX,"Billionaires/hedges make most of their moves in after-hours when retail hands are tied. Last night was down 4.5% at one point.. they all dumped before retail could and gobbled up that retail money/trillions the government printed during covid (last 3 sell-off days)...

VIX 70-90 might be a signal of a bottom. And potentially a good buy opportunity

VIX just went above 50. Not close to 70 yet
 ",0.67,13,1744033902.0
stocks,WARNING: The AI Party Might Be Over - Especially After This 20% Market Crash,"Let's have a serious conversation about Artificial Intelligence and the current state of the market. Over the past couple of years, AI has been the undisputed darling, fueling massive gains in countless stocks, often with little more than an ""AI"" tag attached. We've seen valuations reach dizzying heights, driven by excitement and the fear of missing out on the next big thing.

However, the market has just delivered a brutal wake-up call. In the past few days, we've witnessed a significant 20% crash across major indices. This sudden and sharp downturn throws a glaring spotlight on the unsustainability of many inflated asset prices, and I believe the AI sector is particularly vulnerable to a painful reckoning.
Here's why this 20% market drop could be the pin that bursts the AI bubble:

 * Exposed Overvaluations: Many AI companies, especially those without substantial revenue or proven profitability, were trading at premiums based purely on future potential. This 20% market correction forces a rapid reassessment of risk. Investors are now far less willing to pay exorbitant prices for future promises, and AI stocks with weak fundamentals will likely be the first to suffer a severe correction.

   * Think about it: That small AI startup with a groundbreaking-sounding algorithm but no actual sales? Their sky-high valuation just became incredibly difficult to justify in a market that has suddenly shed 20% of its value.

 * Shift to Safety and Fundamentals: In times of market turmoil, investors tend to flock to safer assets and companies with proven earnings and strong balance sheets. The speculative nature of many AI investments makes them prime candidates for a sell-off as investors prioritize capital preservation over high-risk, high-reward bets.

   * Consider: Why would an investor hold onto an unproven AI stock with a questionable path to profitability when they can invest in established, profitable companies that have also become cheaper due to the broader market decline?

 * Liquidity Concerns and Margin Calls: A 20% market crash can trigger margin calls and force investors to liquidate their holdings to cover losses. Highly leveraged positions in volatile sectors like AI could be particularly at risk, leading to a cascading effect of selling pressure.

 * The ""AI Narrative"" Loses Its Grip: The powerful narrative of AI as a guaranteed path to endless growth is being challenged by the harsh reality of a falling market. Investors are likely to become more critical and demand concrete results rather than simply buying into the hype. Disappointing earnings or slower-than-expected adoption of AI technologies will be punished severely.

 * Increased Scrutiny and Regulation: A market downturn often leads to increased scrutiny of high-growth sectors. Regulators might become more concerned about potential asset bubbles and take a closer look at the AI industry, potentially introducing measures that could further dampen investor enthusiasm.
What should you be doing right now?

 * Take Immediate Stock: Review your portfolio and identify your exposure to AI-related stocks. Understand the underlying fundamentals of these companies – are they actually generating significant revenue and profit, or are they primarily riding the AI wave?

 * De-Risk Aggressively: If you have significant gains in AI stocks, consider taking profits off the table. Reduce your exposure to highly speculative AI companies, especially those with stretched valuations.

 * Focus on Quality and Value: Shift your focus towards companies with strong fundamentals, proven business models, and reasonable valuations. The broader market sell-off might present opportunities in more stable sectors.

 * Prepare for Further Volatility: A 20% market drop can be just the beginning of a larger correction. Be prepared for continued volatility and potential further declines in high-growth sectors like AI.

 * Don't Buy the Dip Blindly: Be extremely cautious about ""buying the dip"" in AI stocks without a clear understanding of their long-term value and resilience in a potentially challenging economic environment.

This 20% market crash isn't just noise; it's a potential inflection point. The easy money fueled by AI hype might be gone, and the market is now demanding tangible results. If you're heavily invested in AI without a strong fundamental basis, now is the time to seriously reconsider your strategy before the potential bubble fully deflates.

What are your thoughts? How is this market downturn impacting your view on AI investments?

Disclaimer: I am just an internet user sharing my opinion and this is not financial advice. Please do your own research before making any investment decisions.
",0.5,0,1744032102.0
stocks,I’m Lost on Investing—How Do I Make the Most of My Accounts?,"
I’m recently started my corporate job, and I feel completely lost when it comes to investing and maximizing my financial accounts. I’ve set up a few, but I’m not sure if I’m using them correctly or what I should be investing in.

Here’s what I have:
	•	Roth IRA – Just opened it, but I have no idea what to invest in or how it really works.
	•	401(k) – I contribute, but I haven’t been monitoring the auto-investments.
	•	HSA – Opened it but don’t know how to use it for investments.
	•	HYSA – Just sitting there, not sure if I should be doing more with it.
	•	Regular Investment Trading Account – Haven’t done much with it yet.

My main questions:
	1.	How do I make the most of all these accounts?
	2.	Where should I actually be investing? Or resources to help me?
	3.	Are there any beginner-friendly strategies to follow?
      4. Is there anything I should do differently due to the new tariff policies?

I’ve never done this before, so any guidance would be greatly appreciated! ",0.69,5,1744031827.0
stocks,"EU ready to negotiate tariffs with US, sets up import task force","The European Union (EU), under the leadership of Commission Chief Ursula von der Leyen, has expressed its readiness to negotiate with the United States on the subject of tariffs. Von der Leyen, who made these comments in Brussels, has stated that the current US tariffs are having a significant impact on developing countries.

In addition to the willingness to negotiate, the EU has also announced the establishment of an import surveillance task force.
The EU’s readiness to engage in negotiations with the US represents a significant step in addressing these issues. The establishment of the import surveillance task force also demonstrates the EU’s commitment to monitor and manage its trade relationships beyond the United States.


",0.78,39,1744031710.0
stocks,"Berkshire Hathaway shrugs off Trump tariff selloff, up 9.41% YTD, adding $87.81B in investor wealth in 2025.","https://www.benzinga.com/25/04/44665484/warren-buffetts-berkshire-hathaway-outpaces-sp-500-adds-8781-billion-in-investor-wealth-in-2025

Warren Buffett‘s Berkshire Hathaway Inc. (BRK)
has outperformed the losses in the S&amp;P 500, while the ‘Oracle of Omaha’ has emerged as the only top 10 billionaire to see a net worth gain on a year-to-date basis in 2025.

Shares of Berkshire Hathaway’s class B shares have risen by 9.41% in 2025, being one of the only few S&amp;P 500 components that are still in the green amid the ongoing market selloff. The S&amp;P 500 index, on the other hand, has fallen 13.54% on a year-to-date basis.

While there has been a flurry of speculations over the company’s cash pile, having the liquid form of dollars has helped the company avert losses amid President Donald Trump‘s tariff-fueled crash on Wall Street.

Berkshire Hathaway’s cash and cash equivalents totaled a record $334.2 billion as of the end of the fourth quarter of 2024.

The firm has also added $87.81 billion in investor wealth in 2025 as its market capitalization has risen from $978.19 billion as of Dec. 31, 2024, to $1,066 billion as of Friday, April 4.

Buffett is also among the only one of the top 10 billionaires, according to Bloomberg’s Billionaire Index, to witness a net worth gain of $12.7 billion in 2025.",0.97,377,1744030739.0
stocks,I'm foreign investor and feeling this time is different :(,"I'm non American investor and this downturn really scares me.

In the past, every time the market dropped, people would say, “This time is different” and panic. But eventually, the market recovered and climbed higher. I experienced Covid and 2022 inflation. 

But this time, what Trump is doing feels like he’s trying to dismantle the entire free trade system itself—and that really frightens me. 

Normal investors believe in the long-term upward trend of the S&amp;P 500 and invest in U.S. stocks with that faith. But now I’m starting to wonder—what if that fundamental assumption no longer holds?


How are people in the U.S. viewing this market downturn caused by Trump?",0.81,405,1744030701.0
stocks,Portfolio Reporting,"Hi, I'm looking for a tool to create PDF reports for a portfolio. I just need to save the holdings with their values ​​and earnings and key information as PDFs—nothing fancy. Is there a free tool to do this? I have used sharesight.",0.75,2,1744030172.0
stocks,Warren Buffet holding a $300 Billion cash pile,Uncle buffet has been holding his largest ever cash position as he felt the market was overvalued. He along with other institutional investors will start buying the dip soon. When they do there will be a huge influx of buyers entering the stock market all at once. This market pullback will easily be bought up and the crash everyone is discussing will be forgotten. The question is if retail investors will have had time to buy this dip or not https://finance.yahoo.com/news/warren-buffett-defended-his-massive-300-billion-cash-pile-in-february-now-he-doesnt-have-to-174312496.html,0.62,16,1744030074.0
