subreddit,title,selftext,upvote_ratio,score,created_utc
stocks,Warsaw Stock Exchange halts trading as global markets tumble,"April 7 (Reuters) - Poland's Warsaw Stock Exchange said on Monday it has suspended trading on all markets from 1315 GMT to 1415 GMT due to ""security of trading"".
The Warsaw bourse's blue-chip WIG20 (.WIG20), opens new tab index, which plunged as much as 7% on Monday, was down 2% prior to the suspension, which came about 15 minutes before the start of U.S. trading session.

""The reasoning is very simple: simply due to trading safety. We see what's happening in the world, we saw what happened on Friday."", Warsaw Stock Exchange press office said.
""Today's market opening was also at very significant negatives, then it calmed down, but due to trading safety (...) the session chairman decided on such a step,"" it added.

**Btw, Japan and Taiwan had circuit breakers pop off today. China market down -13%. Are we due for a circuit breaker after China retaliates against Trump's 50% additional tariffs?** 🤔
",0.88,29,1744052035.0
stocks,Shopify CEO says staffers need to prove jobs can't be done by AI before asking for more headcount,"https://www.cnbc.com/2025/04/07/shopify-ceo-prove-ai-cant-do-jobs-before-asking-for-more-headcount.html

&gt; Shopify CEO Tobi Lutke told employees in a memo that they'll have to show jobs can't be done by artificial intelligence before asking for more headcount and resources.

&gt; CEO Tobi Lutke is changing his company's approach to hiring in the age of artificial intelligence.

&gt; Employees will be expected to prove why they ""cannot get what they want done using AI"" before asking for more headcount and resources, Lutke wrote in a memo to staffers that he posted to X on Monday.

&gt; ""What would this area look like if autonomous AI agents were already part of the team?,"" Lutke wrote in the memo, which was sent to employees late last month. ""This question can lead to really fun discussions and projects.""

&gt; Lutke also said there's a ""fundamental expectation"" across Shopify that employees embrace AI in their daily work, saying it has been a ""multiplier"" of productivity for those who have used it.

&gt; ""I've seen many of these people approach implausible tasks, ones we wouldn't even have chosen to tackle before, with reflexive and brilliant usage of AI to get 100X the work done,"" Lutke wrote.",0.73,10,1744051571.0
stocks,"Here's the Actual Trade War Strategy, and how it will likely Unfold","1. Create a sense of urgency by announcing massive ""reciprocal"" tariffs, which act as the anchor for future negotiations.

2. Make an example out of any country that attempts to retaliate(ie China), to show it's not a bluff.

3. As negotiations take place, the US stays firm, trying to get more out of a deal. The US will stand firm and exercise restraint with deals. Why? Because deals will be public, and every other country will expect the same treatment. Therefore, the US has an incentive to stall until they have fielded offers from everyone, and then only announce the most favorable deals first, to set a baseline for expectations.

4. The white house had to reject rumors of considering a 90-day delay, even if true, because it would've killed their leverage. What is far more likely is much shorter delays for select countries that make compelling offers. We saw this a lot with Canada &amp; Mexico months back.

5. The white house knows it is on a timer. Republicans are already starting to break with their party and vote on bipartisan bills to limit the president's tariff authority. Right now this can be vetoed. But if the trade war goes on long enough and does enough damage, and voters lose trust in the president, the senate/house can get the numbers to override the president. But this won't happen until Trump's approval rating drops considerably.

6. Given this urgency, there is likely an intent to backtrack and establish new deals that are more favorable to the US. However, this cannot be communicated publicly, because doing so would be bad for negotiations(other side needs to think the US is content keeping tariffs in place).

So we may see a bit more of a downturn as uncertainty remains, but most likely, either deals will be made, or congress will intervene once things get bad enough. Therefore, panic selling is a bad idea for long term investors.",0.2,0,1744051334.0
stocks,"Your fear is already ""priced in"".","A common mistake beginners make is believing they can outperform the market simply by following the news. This rarely, if ever, works, even on those infrequent occasions when the market appears to move exactly as predicted based on current events.

The crucial concept to grasp is that prevailing market sentiment—whether positive or negative—is typically already ""priced in."" For instance, if you feel pessimistic about the market's prospects, it's highly probable that many others share that view and have already acted upon it by selling their holdings or establishing short positions. Therefore, the decline you might anticipate based on your negative outlook isn't necessarily a future event; that fear and negativity are likely already reflected in the current price levels.

It's often amusing to see comments like, ""It's strange the market is rallying today; based on the news, it shouldn't be."" Individuals holding this perspective are often destined to buy at market peaks. They wait for unambiguously positive news before feeling confident enough to invest, but by that time, prices are often inflated, and the significant opportunity has passed.

This isn't to definitively claim that we've already reached the absolute bottom. However, it highlights a fundamentally flawed strategy: reacting directly to news cycles and herd sentiment. A more effective approach often involves acting contrary to the prevailing crowd behaviour.

Frankly, whether the current market movement is the final bottom or merely a ""dead cat bounce"" (a temporary recovery during a longer-term decline) is somewhat irrelevant to a sound investment strategy. Trying to perfectly time the market is a futile exercise. The most reliable approach is to focus on acquiring assets at prices you deem fundamentally attractive, irrespective of short-term noise or news headlines. Forget trying to trade the news; it's a game that is exceedingly difficult to win consistently. Focus on identifying good value and investing for the longer term.",0.4,0,1744051058.0
stocks,"Which companies will get good earnings regardless of Trump's tariffs, but have been punished too severely?","Someone responded to an earlier post I made in this huge sub. He/she/x said was looking to buy good forward P/E and FCF stocks after getting Q2 and Q3 results. We have to buy before the news comes out though. Which companies you fully believe will withstand the tariffs and have now been punished too severely by the market?   
  
Or is everything calculated by algos and is there no real bargain to be found? ",0.4,0,1744050903.0
stocks,Vietnam’s zero tariff offer has been rejected by the Trump administration. This offer “means nothing to us.”,"White House trade advisor Peter Navarro said Monday that an offer by Vietnam to eliminate tariffs on U.S. imports would not be enough for the administration to lift its new levies announced last week.

""Let's take Vietnam. When they come to us and say 'we'll go to zero tariffs,' that means nothing to us because it's the nontariff cheating that matters,"" Navarro said on CNBC's 

What's the point in negotiating then? So we are going to see market fall to 400? 🤡🤔",0.97,2237,1744050850.0
stocks,EU Commission proposes 25% tariff on US goods to take effect from May 16th,"BRUSSELS, April 7 (Reuters) - The European Commission proposed counter-tariffs of 25% on a range of U.S. goods on Monday in response to President Donald Trump's tariffs on steel and aluminium, a document seen by Reuters showed.

The tariffs on some goods will come into effect May 16 and others later in the year, on December 1, the document said. The goods are wide- ranging and include diamonds, dental floss, sausages, nuts and soybeans.



https://www.reuters.com/markets/europe/eu-commission-proposes-25-counter-tariffs-some-us-imports-document-shows-2025-04-07/",0.97,676,1744050477.0
stocks,Don't get carried away buying puts.,"Don't get emotional. Don't make bets that you can't cover. 

We're only like 13% down year to date. Don't get too greedy and lose your ass. The market did great under Biden but there were still 3 or 4 major corrections, from December 2021-October 2022 the market dropped 22%.

Some puts are a decent bet right now but don't get drunk on the hype and get a second mortgage on your house or something. The US economy is in a really powerful position because of how well we made out through COVID compared to the rest of the world and other global factors. 

These countries and businesses are going to do whatever makes them the most money and they are not going to have a trade war with the US just to spite Trump. If Trump holds and they crunch the numbers and it makes sense to drop their tarrifs against the US to make more money, they will do it immediately and the market will move substantially in after hours trading and you will get destroyed if you are being reckless with puts. 

Without this bullshit, the market was poised to take off regardless of who's president. This situation could change very quickly. 

Please keep that in mind and don't get lost in the sauce.",0.78,40,1744050221.0
stocks,Is *anything* my financial advisor has been telling me true?,"Should’ve trusted my gut and at least skimmed some off the top in February like I wanted to but every time I call he (70yo white conservative) goes off for a full hour and he talks me out of it. 

His arguments are that the stock market and the government are different. That corporations like Amazon and Apple and Nvidia are *global* and will continue to thrive and increase my portfolio regardless of what happens in the US. “Stonks go up to the moon” in perpetuity because “that’s the way it’s always been”? 

He’s just blowing smoke up my ass, right? These boomers can’t fathom that this is different. And this is different, right? ",0.45,0,1744050170.0
stocks,"It's green acres the board for me today, what happened?","I wanted to buy up some more shares on the cheap. I got $18k burning a hole in my cash reserves I want to get it  working. I guess I could still buy, but it's gonna fuck my Sharpe Ratio. What would the smart money do? ",0.77,12,1744049820.0
stocks,Bet against the Market?,"Hello, I am a somewhat new investor in the sense that I have only been investing with real money for slightly less than a year (due to my age). I am rapidly becoming quite familiar with a lot of concepts and jargon and whatnot, but I have a question. If one was to bet against the entire US market, how would they do that as a retail investors? I thought to myself that one would buy VIX, but then I came to the knowledge that you can’t buy directly VIX, only securities that track the VIX. Would the only other option be to buy put options on the major indices? 

Any and all information is appreciated, thanks! ",0.29,0,1744049494.0
stocks,WSJ explainer on the legality of these tariffs,"This 5 minute video from the Wall Street Journal\* explains how tariffs usually work and what Trump has done differently to get all of these enacted so quickly.

[https://www.wsj.com/video/series/news-explainers/the-legal-logistics-behind-trump-lightning-fast-tariff-process/1BCBC478-DB0A-4693-8976-E1009877804B](https://www.wsj.com/video/series/news-explainers/the-legal-logistics-behind-trump-lightning-fast-tariff-process/1BCBC478-DB0A-4693-8976-E1009877804B)

tl;dw: Normally tariffs go through a lengthy planning and review process, but Trump got around this by calling the overall trade deficit picture a ""national emergency"". This is usually only done to sanction a particular country for some currently emerging reason. The dubious nature of this ""emergency"" may provide legal standing to contest the tariffs.

\* I know some people are going to say they don't like/trust the WSJ. If that's you, apply the ""if even they are saying it, well then.."" maneuver.",0.81,10,1744049228.0
stocks,Are the tarriffs baked in? Is the market actually not reacting enough (and therefore doesn't believe they are a certainty)?,"I'm getting the impression from market news coverage that there is a thought that the tarriffs aren't for certain, that they are a negotiating tactic and that that is reflected in the losses we *haven't* had yet. Curious what you all think?",0.65,7,1744048544.0
stocks,9:43am - what happened,"I was just scanning various stocks today to see how they are this afternoon compared to this morning. I'm noticing that whether a stock is rallying now, every single stock seemed to take its most massive dip at 9:43am. Is this a result of some transaction dump from pre or after market trading? (That does happen doesn't it?) I'm a novice about stocks so feel free to disabuse me of any misconceptions.",0.71,29,1744048117.0
stocks,We have a new Tariff in town,"Oh, here comes Tariff Trump, swinging his economic sledgehammer like a toddler in a china shop! This guy’s threatening to pile more tariffs on top of the existing ones—because nothing screams ""winning"" like turning a trade war into a full-on economic dumpster fire. 

The markets are already puking up 2,200 points, but Donny Boy’s like, “Hold my Diet Coke, I can make this worse!” He’s out here treating global trade like it’s a reality TV showdown—slapping Canada and Mexico with a 25% tariff tantrum and eyeballing China for round two. 

Genius move, champ—let’s tank manufacturing, jack up prices, and give farmers another reason to cry into their corn. It’s like he’s trying to cosplay as the Great Depression’s hype man. Keep it up, Don, you’re roasting the economy so bad even the MAGA hats might start fading!",0.68,18,1744047962.0
stocks,Is a positive trend starting to form?,"Is it just me or is a bullish megaphone top forming...? Cause that wouldn't make ANY sense right...right? 
Surely I am not actually seeing a long term bullish pattern right now.
Please someone correct me.
Nothing makes any sense.",0.54,3,1744047906.0
stocks,Can Trump tariff collapse China like USSR,"Can this Tariff war can collapse china’s economy and collapse the Chinese government like USSR Russia. If Chinese products are expensive in USA and overproduction and raising unemployment in China, can this be the bigger plan? 
",0.13,0,1744047857.0
stocks,"BlackRock CEO says stocks could extend fall by 20%, economy probably in recession","https://www.reuters.com/markets/us/blackrock-ceo-says-stocks-could-extend-fall-by-20-economy-probably-recession-2025-04-07/

April 7 (Reuters) - BlackRock (BLK.N), opens new tab CEO Larry Fink on Monday said stock markets could extend their decline by 20% as the U.S. imposes steep tariffs, noting the economy is probably already in a recession.
Speaking at the Economic Club of New York, Fink expressed worry that there is much more inflationary pressure than the market expects

How fucked are we realistically? 🤔
",0.97,500,1744047699.0
stocks,AMD in the dip,"I've been a fan of AMD since the mid-90s, when I was a video game hardware compatibility tester just learning about PC hardware and the DX4-100 was a bad-ass and cheap chip compared to Intel's equivalents. I've never bought AMD stock but have considered it a few times, then been distracted and the next time I look the price has shot up. The last time I considered buying them was during the post-pandemic dip. I decided to buy in at $80 but didn't because... distracted. Looks like they may go back down to that level and I'm thinking of buying a few stocks for holding.

But I'm wondering if AMD is still the great chip maker it was back then and all through the early 00s. Forward P/E looks good. I'm wondering if there are any red flags suggesting this may not be a good long-term stock to own.",0.83,4,1744047652.0
stocks,VIX Inverse ETFs?,"I'm curious to hear your thoughts on investing in an inverse VIX ETF. The VIX has increased to COVID and financial crisis levels. The charts indicate the price will change faster than stocks. While there's no such thing as free money, investing in these ETFs seems like a sure thing.

Examples:
SVOL
SVXY
 ",0.8,6,1744047423.0
stocks,Intel's long game is about to pay off,"1. It's a domestic chip manufacturer that has the full support of the current administration. 
2. Most of their factories and within the US, no need to ship their chips into the US and pay tariffs.
3. Any tech company that buys chips is currently evaluating their suppliers, and how tariffs will impact profit margins and looking for new suppliers.
4. New CEO
5. Will likley have a partnership agreement with TSM
6. If China makes a grab for Taiwan, that would make INTC the biggest manufacturer in the world as TSM is still working on factory expansion in the US
7. Guidance and earnings are going up from here. 

I bet their sales team is BUSY. 

What's not to love?
",0.59,7,1744047298.0
stocks,Is there anyway to search for stocks that have historically tracked each other?,"With the major drops in the market, I’m thinking of harvesting some losses for tax purposes. But I don’t know that I want to be out of the market. 

I know you can look at industry indexes and different things like that, but was just wondering if there’s a way to search for stocks that have tracked each other closely even if unrelated. ",0.72,3,1744046647.0
stocks,Holding and buying is the best decision right now?,"Currently I have QQM, VOO, and VXUS about 90% domestic and 10% international. I know it is not diversified enough but at the moment I think it would be best to keep the same strategy and keeping investing while the market is low. Any suggestions?",0.75,8,1744045123.0
stocks,What stocks to invest in?,"Hi everyone,

I’m new to investing in stocks and currently educating myself on market trends and strategies. Given the recent market downturn, I’m interested in understanding which sectors or types of stocks might present good entry points for a long-term investor. Any guidance or recommendations would be greatly appreciated.",0.67,5,1744044930.0
stocks,"What does going to ""cash"" mean?","Sorry if this is a dumb question, new here

What does going to cash exactly mean in terms of the stock market? Would it be cashing out like physical cash and holding on to that or keeping it in safer accounts like HYSA or what's the best way to park your money during these times?",0.71,7,1744044293.0
stocks,Is it possible the Tarrif policy is a staged play ?  an Interesting theory for you to consider,"This is my view on the current trade war—do you think it makes sense?  
  
1. \*""Fake Fight"" with Canada and Mexico:\* Trump may have created a staged trade dispute with Canada and Mexico (possibly with Carney's involvement) to show other major trading partners that the U.S. means business.    
2. \*Focus on the EU:\* The main goal is to use this tough stance as a way to get a better trade deal with the European Union.    
3. \*Dealing with China Next:\* After securing a deal with the EU, the U.S. can use that success to pressure China into making bigger trade concessions.    
4. \*Rewarding Allies:\* Since Canada and Mexico are close allies, they’ll eventually be compensated with better trade terms after the bigger fights are settled.    
5. \*Boosting Popularity Before Elections:\* Resolving these trade issues is timed to improve Trump's popularity before the midterm elections.    
  
Does this explanation seem believable to you?  
",0.12,0,1744044197.0
stocks,Long term investment question.,"Over the weekend while visiting some family members the discussion of the current market was discussed heavily. 

Besides my standard 401K I have through my employer I never really thought about investments. 

A few family members told me some simple stocks to throw into weekly or monthly would be SPLG and VOO. 

If I started throwing $50 a week into each (total $100) and I have zero plan to touch this money would this be a good idea? Would it make sense to only put money into one instead of both? 

Appreciate any input as I’m incredibly new to this. Thanks! ",0.5,0,1744043707.0
stocks,"Larry Fink warns about inflation impacts of tariffs, says we're probably in a recession","""Blackrock CEO Larry Fink says he worries that the White House actions are much more inflationary than the market expects. He also said he sees a zero percent chance of four or five Fed rate cuts this year.

He said he sees this as more of a buying opportunity but added ""that doesn't mean we can't fall another 20% from here"".

Fink said the US economy is probably in a recession right now.

Fink is speaking at the Economic Club of New York.""

Source: [https://www.forexlive.com/news/larry-fink-warns-about-inflation-impacts-of-tariffs-20250407/](https://www.forexlive.com/news/larry-fink-warns-about-inflation-impacts-of-tariffs-20250407/)",0.96,179,1744043525.0
stocks,What’s going on with the US stock market?,"Futures have been dropping. Global stock markets dropped 5-15% today. But the US markets are only down ~1% as of 12 pm. All indicators point to huge drops today. So what’s going on?

Is someone keeping the market up?",0.64,28,1744042666.0
stocks,Peter Navarro says Vietnam's 0% tariff offer is not enough: 'It's the nontariff cheating that matters',"https://www.cnbc.com/2025/04/07/peter-navarro-says-vietnams-0percent-tariff-offer-is-not-enough-its-the-non-tariff-cheating-that-matters.html

&gt;White House trade advisor Peter Navarro said Monday that an offer by Vietnam to eliminate tariffs on U.S. imports would not be enough for the administration to lift its new levies announced last week.
&gt;
&gt;""Let's take Vietnam. When they come to us and say 'we'll go to zero tariffs,' that means nothing to us because it's the nontariff cheating that matters,"" Navarro said on CNBC's ""Squawk Box.""
&gt;
&gt;The examples of nontariff ""cheating"" cited by Navarro included Chinese products being routed through Vietnam, intellectual property theft and a value-added tax.

Looks like the hopes of deals being made are dashed as of right now",0.97,575,1744042164.0
stocks,Are investors fleeing all capital markets or are they reallocating their capital?,"I'm seeing 0 stocks pumping, bitcoin is red, gold is red. only thing staying neutral are bonds. What are you doing guys? reallocating your investments or just a full retreat of capital?   
I'm thinking of doing some more buying of companies' stocks I believe in that also pay good dividend, but maybe this is a time to turn to bonds? Not retreating any of my capital, just bringing more in now. What to invest it in is my question. Going intern with the values of companies, or going macro safety with bonds or gold. a little bit of ETF sauce of course, because who doesn't want that ALL world (USA 50%...)",0.67,1,1744041920.0
stocks,The reality of what’s happening.,"It’s crazy I’m at an auto shop getting the car done today and I’m overhearing people talking about the market. This guy in here is saying how it’s all smart and trump is trying to do a 20% cut on purpose. He was saying we need to bring these manufacturing jobs here, and said yeah we need to make tires here! I’m not an expert but I’m fairly sure the US has almost no rubber plantations or manufacturing. 

On top of the other issues like the fact that who the fuck would want to work at a rubber plantation? Then he was saying that hopefully all this manufacturing will be back in the US before the tariffs affect prices! 

He was saying that almost all brake fluid is made in the USA which idk how true that is but sounds false, not to mention it doesn’t ask the question of where do the plastic containers or aluminum containers it’s stored in come from? Not to mention the many other auto parts that aren’t made here and won’t be made here.

He is a normal mechanic in a swing state, just seeing the opinion of the everyday person shows me how deep people are into this and they will not accept that this isn’t part of a master plan in their favor. 

I also notice he keeps talking about the “trillions” of dollars that are going to be invested in this country like they would see any of that. It’s just proof that trump announcing these investments literally works perfectly to placate many. 

My prediction is that the stock market continues to shrink until the tariffs are gone at least and that about half the country will be in denial about it.  ",0.95,4461,1744041773.0
stocks,What stocks are you buying or on your watch list during this bear market,"What equities or industry are you adding your watch list or even buying during this bear market?

I still think software is resilient in a tarrif environment and I am looking to add more AMZN, GOOG, open positions in CRWD. I am also adding VT as a slightly larger portion to hedge ever so slightly against a weak US stock market.

I understand the concerns with the future of these tarrifs and long term impact to US economy, but we are covering those in 1000s of posts across different subreddits, so I wanted a chance to discuss individual stocks or funds to look at. Of course we could be far from the bottom.",0.54,1,1744041658.0
